{
  "spec_version": "2.0",
  "message_id": "018f47f271a247cc88498b335d455174",
  "type": "project.snapshot",
  "occurred_at": "2026-08-10T01:00:00Z",
  "trace_id": "2cfad7be5e5e43f694db6f53ad52c917",
  "sender": { "kind": "device", "id": "local-mac" },
  "payload": {
    "projects": [
      {
        "id": "project_9ee725d8a4b33e8da19d02d4",
        "name": "orders-api",
        "path": "/Users/developer/work/orders-api",
        "thread_count": 3,
        "updated_at": "2026-08-10T00:55:00Z"
      }
    ]
  }
}
