{
  "spec_version": "2.0",
  "message_id": "55555555555545558555555555555555",
  "type": "thread.snapshot",
  "occurred_at": "2026-08-10T02:20:03Z",
  "trace_id": "44444444444444448444444444444444",
  "sender": { "kind": "device", "id": "local-mac" },
  "payload": {
    "project_id": "project_9e8638437f803c29d91a3844",
    "threads": [
      {
        "id": "019fe7da-7105-7831-8c0c-8997786ddd3f",
        "project_id": "project_9e8638437f803c29d91a3844",
        "title": "只读检查这个项目",
        "preview": "请仅回答 Go module 路径",
        "latest_message_preview": "Go module 路径是 github.com/codex-remote/relay-server。",
        "status": "notLoaded",
        "source": "vscode",
        "updated_at": "2026-08-10T02:52:30Z"
      }
    ]
  }
}
