{
  "spec_version": "2.0",
  "message_id": "318f47f271a247cc88498b335d455175",
  "type": "execution.profile.snapshot",
  "occurred_at": "2026-08-11T07:00:01Z",
  "trace_id": "4cfad7be5e5e43f694db6f53ad52c918",
  "sender": { "kind": "device", "id": "local-mac" },
  "payload": {
    "project_id": "project_9ee725d8a4b33e8da19d02d4",
    "default_profile_id": ":workspace",
    "profiles": [
      { "id": ":read-only", "allowed": true },
      { "id": ":workspace", "allowed": true },
      { "id": ":danger-full-access", "allowed": true }
    ]
  }
}
