{
  "spec_version": "2.0",
  "message_id": "4a925b8939334c1c891e8cd2b61bb704",
  "type": "turn.completed",
  "occurred_at": "2026-08-10T01:04:21Z",
  "trace_id": "3cfad7be5e5e43f694db6f53ad52c918",
  "sender": { "kind": "device", "id": "local-mac" },
  "payload": {
    "project_id": "project_9ee725d8a4b33e8da19d02d4",
    "thread_id": "0198c3a0-ff21-7330-a910-62b85a688f70",
    "turn_id": "0198c3a1-932f-7ca1-8ca6-29c07dd85aae",
    "duration_ms": 201000,
    "summary": "Tests pass after correcting the order state transition.",
    "changed_files": ["internal/order/service.go"],
    "diff": "diff --git a/internal/order/service.go b/internal/order/service.go",
    "diff_truncated": false
  }
}
